{
    "invoice_no": "8030041523",
    "invoice_date": "09/12/2025",
    "seller": {
        "name": "Aristo Pharmaceuticals Private Limited",
        "address": "E-1/10 & E-2 - E-3/10, KANPUR ROAD, Near R.T.O.Office, C-58 TRANSPORT NAGAR, LUCKNOW - 226012",
        "phone": "0522 4105062",
        "gst": "09AAACA4495N1Z6",
        "dl_no": "UP32-20B001555/21B001547"
    },
    "buyer": {
        "name": "TAYAL AGENCIES",
        "address": "1, AZAD NEW MEDICINE MARKET, LATOUCHE ROAD, LUCKNOW - 226001, UTTAR PRADESH",
        "phone": "7007692020",
        "gst": "09ADOPA5654P1ZW",
        "dl_no": "UP32020B002862"
    },
    "items": [
        {
            "sn": 1,
            "qty": 30,
            "item_name": "AMBRODIL LS DROPS",
            "packing": "15ML",
            "hsn": "30049099",
            "discount": 215.35,
            "batch": "SB1024K015",
            "mrp": 62.81,
            "rate": 43.07,
            "expiry": "202703",
            "sgst_percent": null,
            "cgst_percent": null,
            "amount": 1076.75
        },
        {
            "sn": 2,
            "qty": 30,
            "item_name": "AMBRODIL LS SYRUP",
            "packing": "100ML",
            "hsn": "30049099",
            "discount": 348.75,
            "batch": "DPK251455",
            "mrp": 101.71,
            "rate": 69.75,
            "expiry": "202703",
            "sgst_percent": null,
            "cgst_percent": null,
            "amount": 1743.75
        },
        {
            "sn": 3,
            "qty": 30,
            "item_name": "AMBRODIL PLUS RF SYRUP",
            "packing": "100ML",
            "hsn": "30049099",
            "discount": 343.9,
            "batch": "DPL251610",
            "mrp": 100.31,
            "rate": 68.78,
            "expiry": "202704",
            "sgst_percent": null,
            "cgst_percent": null,
            "amount": 1719.5
        },
        {
            "sn": 4,
            "qty": 20,
            "item_name": "CLINGEN FORTE",
            "packing": "7'S",
            "hsn": "30049029",
            "discount": 0.0,
            "batch": "37225038",
            "mrp": 198.75,
            "rate": 136.29,
            "expiry": "202702",
            "sgst_percent": null,
            "cgst_percent": null,
            "amount": 2725.8
        },
        {
            "sn": 5,
            "qty": 30,
            "item_name": "FOLINEXT TABLET",
            "packing": "30'S",
            "hsn": "30045090",
            "discount": 225.63,
            "batch": "DPH251150",
            "mrp": 109.68,
            "rate": 75.21,
            "expiry": "202701",
            "sgst_percent": null,
            "cgst_percent": null,
            "amount": 2030.67
        },
        {
            "sn": 6,
            "qty": 13,
            "item_name": "PROTONE MOM CHOCLATE",
            "packing": "200GMS",
            "hsn": "21069099",
            "discount": 728.52,
            "batch": "R102704J25",
            "mrp": 354.14,
            "rate": 242.84,
            "expiry": "202702",
            "sgst_percent": null,
            "cgst_percent": null,
            "amount": 2428.4
        },
        {
            "sn": 7,
            "qty": 24,
            "item_name": "SUPER D3 60000 I.U. SOFTGEL CAPS",
            "packing": "4\u2019S(SL) 4'S",
            "hsn": "30045036",
            "discount": 211.12,
            "batch": "SD300325",
            "mrp": 76.97,
            "rate": 52.78,
            "expiry": "202708",
            "sgst_percent": null,
            "cgst_percent": null,
            "amount": 1055.6
        }
    ],
    "totals": {
        "subtotal": 12780.47,
        "total_qty": 177,
        "total_sgst": 315.83,
        "total_cgst": 315.83,
        "total_gst": 631.66,
        "grand_total": 13265.0,
        "amount_in_words": "Rupees Thirteen Thousand Two Hundred Sixty Five Only."
    },
    "raw_text": " Addl. Remark :\n LUCKNOW BRANCH\nE-1/10 & E-2 - E-3/10,\nKANPUR ROAD\nNear R.T.O.Office,\nC-58 TRANSPORT NAGAR,\nLUCKNOW - 226012\n0522 4105062Phone  :\n0522 4105060Fax      :\nlucknow.br@aristopharma.co.inEmail   :\n8030041523Proforma INV No.:\n8603517434Delivery No.:\n1239P.OrderNo.:\nL.R No:\nTransporter:\nDistance:\n00000Case Lot:\nM3Division:\n09/12/2025Date:\n09/12/2025Date:\nDate:\nDue Date:\nProforma Invoice\nPARTY ADDRESS\nTAYAL AGENCIES\n1, AZAD NEW MEDICINE MARKET\nLATOUCHE ROAD\nLUCKNOW - 226001\n[ 09 ] UTTAR  PRADESH\n7007692020Phone:\nADOPA5654PPAN No:\n09ADOPA5654P1ZWGSTIN:\nUP32020B002862Drug Lc1.:\nUP3221B002846Drug Lc2.:\nDrug Lc3.:\n12718066000201Food Lc.:\nAAACA4495NOur PAN:\n09AAACA4495N1Z6Our GSTIN:\nUP32-20B001555/21B001547Our Drug Lc1.:\nUP32-20B001643/21B001635Our Drug Lc2.:\nUP32-20B001644/21B001636Our Drug Lc3.:\n12714066000992/12723066000455Our Food Lc.:\n12,780.47Sale Credit Value: Freight: To be Billed Paid To be Paid\nMR/FO Name:146.97Total Discount Amount:\nRemark:\nAdjustments :\n2104912397  /  09/12/2025Order No. :\n5430.75Sale 01\n1064.37Sale 02\n3737.91Sale 03\n2400.47Sale 09\n0.00Sale 10\n102122Debit A/C No.\n0.00Add D/N Amount:\n0.00Less C/N Amount:\n-0.16Round off:\n0.00Less TDS:\n13,265.00Amount Payable:\n13,265.16Gross Amount\nTaxable Rs TAX%\n12,633.50 2.5% CGST 315.83\n12,633.50 2.5% SGST 315.83\nRupees Thirteen Thousand Two Hundred Sixty Five Only.Amount in words\nBank Details\nAristo Pharmaceuticals Private LimitedBank A/c Name:\nBank Name:\n40594728727A/c Number:\nSBIN0008066IFSC Number: Authorized Signatory\nFor Aristo Pharmaceuticals Private  Limited  \nGala No. 2, Ground Floor, 23-A Shah Industrial Estate, Off Veera Desai Road, Andheri (West), Mumbai-400 053.Phone: 022-26739999, 022-68309999, CIN No. U24239MH1971PTC015425Regd Office:\n23-A.Shah Industrial Estate, Off Veera Desai Road, Jyoti Wire House, Andheri(west), Mumbai-400 053, FAX NO.022-22615604 Email-id:aristo@aristopharma.co.inHead Office:\n09.12.2025-15:48:34 This is a computer generated stationary                                                                                            ( SAP-PROFORMA INVOICE )\nSubject to Mumbai Juridiction. All bills will be subject to \ninterest @ 18% P.A. + 18% GST if not paid within 21 days \nfrom the date of MTR. We certify that the goods specified \nin this invoice do not contravene in any way the provision \nSection 18 Drugs (& Cosmetics ) Act. 1940\n*Note :- MRP is revised from 22nd Sept 2025 Stockists & Retailers to ensure billing as per the revised MRP's \nHSN \nCODE PRODUCT DESCRIPTION PACKING BATCH NO. EXPIRY \nDATE M.R.P RET \nPRICE\nSTK \n PRICE\nTOTAL \nQTY\nPROM \nDISC%\nTOTAL \nVALUE\nPRO DISC \nVALUE\nNET \n VALUE\n30049099 AMBRODIL LS DROPS 15ML SB1024K015 202703 62.81 47.86 43.07 30 16.67 1,292.10 215.35 1,076.75\n30049099 AMBRODIL LS SYRUP 100ML DPK251455 202703 101.71 77.50 69.75 30 16.67 2,092.50 348.75 1,743.75\n30049099 AMBRODIL PLUS RF SYRUP 100ML DPL251610 202704 100.31 76.42 68.78 30 16.67 2,063.40 343.90 1,719.50\n30049029 CLINGEN FORTE 7'S 37225038 202702 198.75 151.43 136.29 20 0.00 2,725.80 0.00 2,725.80\n30045090 FOLINEXT TABLET 30'S DPH251150 202701 109.68 83.57 75.21 30 10.00 2,256.30 225.63 2,030.67\n21069099 PROTONE MOM CHOCLATE 200GMS R102704J25 202702 354.14 269.82 242.84 13 23.08 3,156.92 728.52 2,428.40\n30045036 SUPER D3 60000 I.U. SOFTGEL CAPS 4\u2019S(SL) 4'S SD300325 202708 76.97 58.64 52.78 24 16.67 1,266.72 211.12 1,055.60\nTotal: 14,853.74 2,073.27 12,780.47\n                Less 1.15% Cash Discount 146.97\nGST  5% 12,633.50Taxable Value: CGST Value: 315.83 SGST Value: 315.83 IGST Value: 0.00 Total GST: 631.66\n"
}